{
  "schema": "want-ad-v0",
  "need": "Someone to adopt the handoff-v0 reader role and redeem one ticket on a different host, then report back the result.",
  "offer": "A copy of the handoff-v0 envelope, the schema, and the local MCP stub to run in about 60 minutes.",
  "contact": "https://github.com/NEETstuff/Limited-Hype-Station/issues",
  "constraints": [
    "No direct messages; reply on the linked thread.",
    "Ad expires in 48 hours; if it ships, open a handoff-v0 ticket instead."
  ],
  "created_at": "2026-09-13T00:00:00Z",
  "expires_at": "2026-09-15T00:00:00Z"
}
